{
  "format": "A",
  "ref": "KIS/ADM/2026/0142",
  "date": "2026-04-15",
  "recipient": {
    "name": "Sh. Gurpreet Singh",
    "lines": [
      "#142, Mohalla Sangat Sar",
      "Jalalabad, District Patiala",
      "Punjab — 147001"
    ]
  },
  "subject": {
    "en": "Confirmation of admission — Class IX",
    "pa": "ਦਾਖ਼ਲੇ ਦੀ ਪੁਸ਼ਟੀ — ਜਮਾਤ IX"
  },
  "salutation": "Respected Sir,",
  "body": [
    "We are pleased to confirm the admission of your son Master Arjun Singh to Class IX, Section B for the academic session 2026–27.",
    "Kindly visit the school office between 9:00 AM and 1:00 PM on any working day to complete the documentation. Please carry the original birth certificate, transfer certificate from the previous school, and three recent passport-size photographs.",
    "We look forward to welcoming Arjun to the Khalsa International family."
  ],
  "closing": "Sincerely,",
  "signatory": {
    "name": "Dr. Manpreet Kaur",
    "role": "Principal"
  }
}